{
  "seq" : 9,
  "gameId" : "1-1",
  "timeoutSec" : 300,
  "seat" : 1,
  "turn" : 1,
  "phase" : "MAIN1",
  "decisionType" : "CAST_SPELL",
  "prompt" : "Choose a spell/ability to play, or pass.",
  "state" : {
    "seat" : 1,
    "turn" : 1,
    "phase" : "MAIN1",
    "life" : 20,
    "poison" : 0,
    "commandZone" : [ ],
    "manaPool" : 0,
    "untappedManaSourceCount" : 4,
    "manaSources" : [ {
      "id" : 1,
      "name" : "Swamp",
      "yield" : 1,
      "colors" : "B",
      "count" : 3
    }, {
      "id" : 7,
      "name" : "Sol Ring",
      "yield" : 2,
      "colors" : "colorless"
    }, {
      "id" : 9,
      "name" : "Llanowar Elves",
      "yield" : 1,
      "colors" : "G",
      "sick" : true
    } ],
    "manaAvailableNow" : 5,
    "manaReach" : 5,
    "ritualsInHand" : [ {
      "id" : 10,
      "name" : "Dark Ritual",
      "cost" : "{B}",
      "kind" : "ritual",
      "yield" : 3,
      "net" : 2,
      "colors" : "B"
    } ],
    "handSize" : 3,
    "handLands" : 0,
    "librarySize" : 3,
    "ownBoardPower" : 3,
    "battlefield" : [ {
      "id" : 1,
      "name" : "Swamp",
      "types" : "Basic Land - Swamp",
      "tapped" : false,
      "abilities" : [ {
        "cost" : "{T}",
        "desc" : "{T}: Add {B}.",
        "producesMana" : true
      } ]
    }, {
      "id" : 3,
      "name" : "Swamp",
      "types" : "Basic Land - Swamp",
      "tapped" : false,
      "abilities" : [ {
        "cost" : "{T}",
        "desc" : "{T}: Add {B}.",
        "producesMana" : true
      } ]
    }, {
      "id" : 5,
      "name" : "Swamp",
      "types" : "Basic Land - Swamp",
      "tapped" : false,
      "abilities" : [ {
        "cost" : "{T}",
        "desc" : "{T}: Add {B}.",
        "producesMana" : true
      } ]
    }, {
      "id" : 7,
      "name" : "Sol Ring",
      "types" : "Artifact",
      "tapped" : false,
      "abilities" : [ {
        "cost" : "{T}",
        "desc" : "{T}: Add {C}{C}.",
        "producesMana" : true
      } ]
    }, {
      "id" : 8,
      "name" : "Grizzly Bears",
      "power" : 2,
      "toughness" : 2,
      "sick" : true,
      "types" : "Creature - Bear",
      "tapped" : false,
      "abilities" : [ ]
    }, {
      "id" : 9,
      "name" : "Llanowar Elves",
      "power" : 1,
      "toughness" : 1,
      "sick" : true,
      "types" : "Creature - Elf Druid",
      "tapped" : false,
      "abilities" : [ {
        "cost" : "{T}",
        "desc" : "{T}: Add {G}.",
        "producesMana" : true
      } ]
    } ],
    "hand" : [ {
      "name" : "Dark Ritual",
      "manaCost" : "{B}",
      "types" : "Instant"
    }, {
      "name" : "Counterspell",
      "manaCost" : "{U}{U}",
      "types" : "Instant"
    }, {
      "name" : "Divination",
      "manaCost" : "{2}{U}",
      "types" : "Sorcery"
    } ],
    "command" : [ ],
    "graveyard" : [ "Island" ],
    "exile" : [ ],
    "opponents" : [ {
      "seat" : 0,
      "life" : 20,
      "poison" : 0,
      "creaturePower" : 2,
      "battlefield" : [ {
        "id" : 14,
        "name" : "Grizzly Bears",
        "power" : 2,
        "toughness" : 2,
        "sick" : true,
        "types" : "Creature - Bear",
        "tapped" : false
      } ],
      "handSize" : 1,
      "librarySize" : 0,
      "graveyard" : [ ],
      "exile" : [ ],
      "commandZone" : [ ]
    } ],
    "stack" : [ ],
    "stackOwners" : [ ],
    "stackKinds" : [ ],
    "stackTargets" : [ ],
    "stackOracle" : [ ]
  },
  "options" : [ {
    "id" : 0,
    "label" : "Pass (do nothing)",
    "cost" : null,
    "type" : "PASS"
  }, {
    "id" : 1,
    "label" : "Dark Ritual  {B} — Dark Ritual (10) - seat adds {B}{B}{B}.",
    "cost" : "{B}",
    "type" : "Instant"
  }, {
    "id" : 2,
    "label" : "Counterspell  {U}{U} — Counter target spell.",
    "cost" : "{U}{U}",
    "type" : "Instant"
  }, {
    "id" : 3,
    "label" : "Divination  {2}{U} — Divination (12) - seat draws two cards.",
    "cost" : "{2}{U}",
    "type" : "Sorcery"
  }, {
    "id" : 4,
    "label" : "Sol Ring  {T} — Sol Ring (7) - seat adds {C}{C}. [currently adds 2 mana]",
    "cost" : "{T}",
    "type" : "Artifact"
  } ]
}
